item_name,description,github,gist,gitlab,bitbucket,launchpad,twitter,youtube,blogpost,cran,pypi,codeberg,website,publication,DOI,author1_name,author2_name,author3_name,author4_name,author5_name,author6_name,category,platform,tag1,tag2,tag3,tag4,tag5,notes,internetarchive
tutorial-autocad2018,AutoCAD tutotial for archaeologists.,https://github.com/chrinne/tutorial-autocad2018,,,,,,,,,,,,,,chrinne,,,,,,Guides,,Educational resources and practical guides,3D modelling,,,,,
CoccionCeramica,An application to generate temperature curves during pottery firing.,https://github.com/marcelocardillo/CoccionCeramica,,,,,,,,,,,,,,marcelocardillo,,,,,,Packages and libraries,Python,Ceramic analysis,,,,,,
archaeology-machine-learning,Machine learning techniques for archaeology.,https://github.com/lakillo/archaeology-machine-learning,,,,,,,,,,,,,,lakillo,,,,,,Lists and datasets,,Lists,Machine learning,,,,,
rockart-textanalysis,A text analysis program to explore online content about prehistoric rock art.,https://github.com/lakillo/rockart-textanalysis,,,,,,,,,,,,,,lakillo,,,,,,Packages and libraries,Python,Public archaeology,Machine learning,,,,,
WeedEco,Classification of unknown cases (e.g. archaeobotanical data or other modern weed survey data) using linear discriminant analysis to understand farming regimes.,https://github.com/WeedEco/WeedEco,,,,,,,,,,,,,,WeedEco,,,,,,Packages and libraries,R,Palaeobotany,,,,,,
CropPro,"Data organisation, classification and visualisation of archaeobotanical data to understand crop processing stage.",https://github.com/CropPro-package/CropPro,,,,,,,,,,,,,,CropPro-package,,,,,,Packages and libraries,R,Palaeobotany,Data management,,,,,
ruby-radiocarbon,Ruby gem for fast radiocarbon calibration.,https://github.com/joeroe/ruby-radiocarbon,,,,,,,,,,,,,,joeroe,,,,,,Packages and libraries,Ruby,"Radiocarbon dating, calibration and sequencing",,,,,,
dendroNetwork,Enables researchers to easily construct a network of dendrochronological series based on the similarity and find patterns of matching tree-ring material.,https://github.com/ropensci/dendroNetwork/,,,,,,,,https://cran.r-project.org/package=dendroNetwork,,,https://docs.ropensci.org/dendroNetwork/,,,ropensci,RonaldVisser,,,,,Packages and libraries,R,Dendrochronology,Chronological modelling,,,,,
ABMA_tutorials,A set of interactive tutorials to build agent-based models and how to use them in your work as archaeologist. These tutorials are both suitable for beginners and people who want to brush up their modelling skills.,https://github.com/ABMArchaeologists/ABMA_tutorials,,,,,,,,,,,https://abmarchaeologists.github.io/ABMA_website/,,,ABMArchaeologists,RonaldVisser,drocks13,,,,Standalone software,NetLogo,Educational resources and practical guides,Simulation,,,,"Need to add more author columns and revise the way these columns are parsed. Additional authors not currently represented include: Doug Rocks-Macqueen, Laura van der Knaap, Annemarie Jutte, , Ronald Visser, Jeroen Linssen, Tom Brughmans, Iza Romanowska, Kenneth Aitchison, Karsten Lambers.",
quantum-archeo,Set of quantitative tools for finding a common measurement unit (quantum) in archeological research.,https://github.com/maciejkasinski/quantum-archeo,,,,,,,,,,,,,,maciejkasinski,,,,,,Scripts,R,Statistical analysis,,,,,,
chrongler,"Provides convenience functions that are helpful for working with archaeological or historical data, where chronological information is stored as a period.",https://github.com/lsteinmann/chrongler,,,,,,,,,,,,,,lsteinmann,,,,,,Packages and libraries,R,Chronological modelling,Data management,,,,,
Dendro_R,Small repository that lists R packages used in dendrochronology or tree-ring research.,https://github.com/RonaldVisser/Dendro_R,,,,,,,,,,,https://ronaldvisser.github.io/Dendro_R/,,,RonaldVisser,,,,,,Lists and datasets,,Dendrochronology,Lists,,,,,
ARQUB,Scripts at the ARQUB group to work with compositional data on archaeometric studies.,https://github.com/jbuxeda/ARQUB,,,,,,,,,,,,,,jbuxeda,,,,,,Scripts,R,Statistical analysis,,,,,,
mafa,"Computes morphological indices of spatial entities (e.g. parcels, buildings).",https://github.com/JGravier/mafa,,,,,,,,,,,https://jgravier.github.io/mafa/,,,JGravier,,,,,,Packages and libraries,R,Spatial analysis,,,,,,
kart4arch,Tutorial to drive step by step any practitioner interested in learning how to use Kart.,https://github.com/UnitoAssyrianGovernance/kart4arch,,,,,,,,,,,https://unitoassyriangovernance.github.io/kart4arch/,,,UnitoAssyrianGovernance,andreatitolo,apalmisano82,,,,Guides,,Data management,Educational resources and practical guides,,,,,
SiteSyncro,Site-specific chronological modeling and synchronization.,https://github.com/demjanp/SiteSyncro,,,,,,,,,,,https://sitesyncro.readthedocs.io/en/latest/,https://doi.org/10.1017/RDC.2020.129,,demjanp,,,,,,Packages and libraries,Python,Chronological modelling,"Radiocarbon dating, calibration and sequencing",,,,,
baorista,Provides a Bayesian inferential tool for analysing time-frequencies of archaeological events associated with time spans typically obtained from relative chronological sequences (e.g. periods and phases).,https://github.com/ercrema/baorista,,,,,,,,,,,,https://doi.org/10.1111/arcm.12984,,ercrema,,,,,,Packages and libraries,R,Chronological modelling,Data management,,,,,
crom,Python library to make creation of CIDOC CRM easier by mapping classes/predicates to python objects.,https://github.com/thegetty/crom,,,,,,,,,,,,,,thegetty,,,,,,Packages and libraries,Python,Schemas and ontologies,,,,,,
carbondate,R package to analyse multiple radiocarbon determinations.,https://github.com/TJHeaton/carbondate,,,,,,,,https://cran.r-project.org/package=carbondate,,,https://tjheaton.github.io/carbondate/,https://doi.org/10.1111/rssc.12599,,TJHeaton,sara-amira-alassam,,,,,Packages and libraries,R,"Radiocarbon dating, calibration and sequencing",,,,,,
RJradiocarbon,Radiocarbon calibration of multiple 14C samples using reversible jump poisson process.,https://github.com/sara-amira-alassam/RJradiocarbon,,,,,,,,,,,,,,sara-amira-alassam,,,,,,Packages and libraries,R,"Radiocarbon dating, calibration and sequencing",,,,,,
Mycenaean Atlas Project ,The purpose of the Mycenaean Atlas is to furnish accurate lat/lon pairs for Bronze Age sites in the central and eastern Mediterranean.,,,,,,,,,,,,http://helladic.info/,,,Robert Consoli,,,,,,Lists and datasets,,Lists,,,,,,
Curso_Intro_R_Arqueologia,Introductory course to R for archaeologists (Spanish).,https://github.com/Mcotsar/Curso_Intro_R_Arqueologia,,,,,,,,,,,,,,Mcotsar,,,,,,Guides,,Educational resources and practical guides,,,,,,
neonet,NeoNet serves as a framework to study the transition from the Late Mesolithic to the Early Neolithic through spatio-temporal modeling of radiocarbon dates,https://github.com/zoometh/neonet,,,,,,,,,,,,,,zoometh,,,,,,Packages and libraries,R,"Radiocarbon dating, calibration and sequencing",,,,,,
c14Intervals,R package for calculating probability intervals and point estimates for calibrated radiocarbon dates.,https://github.com/jallison7/c14Intervals,,,,,,,,,,,,,,jallison7,,,,,,Packages and libraries,R,"Radiocarbon dating, calibration and sequencing",,,,,,
SurveyeR,Uses a Dirichlet process to probabilistically assess the phase of undated archaeological assemblages.,https://github.com/acortell3/SurveyeR,,,,,,,,,,,,,,acortell3,,,,,,Packages and libraries,R,Seriation,,,,,,
cran-JSDNE,JSDNE is an age estimation methods with 3D reconstructed auricular surface.,https://github.com/jisunjang19/cran-JSDNE,,,,,,,,https://cran.r-project.org/package=JSDNE,,,,https://doi.org/10.1016/j.jas.2024.106080,,jisunjang19,,,,,,Packages and libraries,R,Artefact morphology,,,,,,
eratosthenes,"Provides a coherent foundation for archaeological chronology-building by incorporating, computationally, all relevant sources of information on uncertain archaeological or historical dates.",https://github.com/scollinselliott/eratosthenes,,,,,,,,,,,,,,scollinselliott,,,,,,Packages and libraries,R,Chronological modelling,,,,,,
lakhesis,"Provides an interactive platform and critical measures for seriating binary data matrices through the exploration, selection, and consensus of partially seriated sequences.",https://github.com/scollinselliott/lakhesis,,,,,,,,https://cran.r-project.org/package=lakhesis,,,,,,scollinselliott,,,,,,Packages and libraries,R,Statistical analysis,,,,,,
ArchaeoMag,Program for the modelling of magnetic anomalies in archaeological research.,https://github.com/antonio-schettino/ArchaeoMag,,,,,,,,,,,,https://doi.org/10.4430/bgta0296,,antonio-schettino,,,,,,Standalone software,,Geophysical survey,,,,,,
MoDuLAAR,"comprehensive toolkit designed to model and analyze racemization processes in amino acids. This project integrates data processing, dehydration analysis, racemization simulation, parameter optimization, and result visualization to provide a robust framework for studying amino acid kinetics.",https://github.com/Palaeoprot/ModulAAR,,,,,,,,,,,https://www.palaeome.org/get-involved/software/modulaar,,,Palaeoprot,,,,,,Packages and libraries,Python,Palaeoproteomics,,,,,,
