item_name,description,github,gist,gitlab,bitbucket,launchpad,twitter,youtube,blogpost,cran,pypi,codeberg,website,publication,DOI,author1_name,author2_name,author3_name,author4_name,author5_name,author6_name,category,platform,tag1,tag2,tag3,tag4,tag5,notes,internetarchive
nearpresence,"Implements Near Presence Cluster Analysis, a statistical method for identifying spatial clustering within presence / absence data observed in irregularly distributed areal observation units.",https://github.com/eweaverdyck/nearpresence,,,,,,,,,,,,,,eweaverdyck,,,,,,Packages and libraries,R,Statistical analysis,Spatial analysis,,,,,
DACORD,Computer-Assisted Drawing of Archaeological Pottery.,https://github.com/jwilczek-dotcom/DACORD,,,,,,,,,,,,,,jwilczek-dotcom,,,,,,Scripts,R,Shape recognition,Artefact morphology,Ceramic analysis,,,,
RACORD,Computer-Assisted Shape Classification of Archaeological Pottery Fragments.,https://github.com/jwilczek-dotcom/RACORD,,,,,,,,,,,,,,jwilczek-dotcom,,,,,,Scripts,R,Shape recognition,Artefact morphology,Ceramic analysis,,,,
dplR,"Perform tree-ring analyses such as detrending, chronology building, and crossdating.",https://github.com/AndyBunn/dplR,,,,,,,,,,,,,,AndyBunn,,,,,,Packages and libraries,R,Dendrochronology,Chronological modelling,,,,,
xDateR,Shiny app for interactive crossdating of tree-ring data.,https://github.com/AndyBunn/xDateR,,,,,,,,,,,,,,AndyBunn,,,,,,Packages and libraries,R,Dendrochronology,Chronological modelling,,,,,
kidstats,Shiny application that provides subadult age estimations based on dental and skeletal development and skeletal diaphyseal metrics using pre-optimized mixed cumulative probit models.,https://github.com/ElaineYChu/kidstats,,,,,,,,,,,,,,ElaineYChu,,,,,,Scripts,R,Biological anthropology,,,,,,
tRauma,Interactive graphical user interface to aid in the interpretation of blunt-force rib trauma in forensic anthropology casework.,https://github.com/ElaineYChu/tRauma,,,,,,,,,,,,,,ElaineYChu,,,,,,Scripts,R,Biological anthropology,,,,,,
Pofatu,An open-access database for geochemical sourcing of archaeological materials.,https://github.com/pofatu/pofatu-data,,,,,,,,,,,https://pofatu.clld.org/,https://doi.org/10.5281/zenodo.4726799,,pofatu,,,,,,Lists and datasets,,Datasets,Geoarchaeology,,,,,
pypofatu,A python package to curate Pofatu data.,https://github.com/pofatu/pypofatu,,,,,,,,,,,,,,pofatu,,,,,,Packages and libraries,Python,Drivers and IO,Geoarchaeology,Datasets,,,,
pygeoroc,Python library to access data in the GEOROC database.,https://github.com/pofatu/pygeoroc,,,,,,,,,,,,,,potafu,,,,,,Packages and libraries,Python,Drivers and IO,Geoarchaeology,Datasets,,,,
Open History Map,A web-GIS platform containing spatial historical and archaeological data.,https://github.com/openhistorymap,,,,,,,,,,,http://www.openhistorymap.org/,,,openhistorymap,,,,,,Standalone software,,Site mapping,Public archaeology,,,,,
hsv-api,Historical Street View API,https://github.com/openhistorymap/hsv-api,,,,,,,,,,,https://visions.ofthepast.org/,,,openhistorymap,,,,,,Standalone software,,Site mapping,Public archaeology,Drivers and IO,,,,
OHM Data Index,The data index considers a collection of research areas that broadly stroke an idea of the level of completeness in the knowledge of a given period and timeframe.,,,,,,,,,,,,https://index.openhistorymap.org/,,,openhistorymap,,,,,,Lists and datasets,,Site mapping,Public archaeology,Data management,,,,
Mask_UAV,"Software to annotate, train, using deep learning, and segment imagery data from UAVs or other platforms.",https://github.com/maltaweel/Mask_UAV,,,,,,,,,,,,,,maltaweel,,,,,,Packages and libraries,Python,Site mapping,Aerial and satellite imagery,Drones,,,,
chi-field-manual,A bookdown powered manual for the small scale cultural heritage organization looking to leverage various chi techniques for their own collections.,https://github.com/XLabCU/chi-field-manual,,,,,,,,,,,https://xlabcu.github.io/chi-field-manual,,,XLabCU,,,,,,Guides,,Educational resources and practical guides,Statistical analysis,,,,,
A bibliography of public archaeology and archaeological heritage management in the Mediterranean,A collection of references about public archaeology and archaeological heritage management in/from the Mediterranean.,,,,,,,,,,,,https://digital.csic.es/handle/10261/223340,https://doi.org/10.20350/digitalCSIC/12720,,Jaime Almansa Sánchez,,,,,,Lists and datasets,,Bibliography,Public archaeology,,,,,
CHARM,Cultural heritage abstract reference model.,,,,,,,,,,,,http://www.charminfo.org/,,,CHARM,,,,,,"Specifications, protocols and schemas",,Data management,Schemas and ontologies,,,,,
Corallium Fabrica,"Set of 3D models of coral skeletons, which may be used as a reference collection.",,,,,,,,,,,,https://corallumfabrica.laas.fr/,,,Elise Rigot,,,,,,Lists and datasets,,3D modelling,Datasets,,,,,
SexEst,Uses machine learning models to predict the Sex of unknown skeletons based on their cranial and postcranial measurements.,https://github.com/cconsta1/SexEst,,,,,,,,,,,,,,cconsta1,,,,,,Packages and libraries,Python,Biological anthropology,Shape recognition,,,,,
web_geochemistry,Visualizing XRF and NAA geochemistry concentrations.,https://github.com/arf-berkeley/web_geochemistry,,,,,,,,,,,,,,arf-berkeley,,,,,,Packages and libraries,R,X-Ray Fluorescence,Instrumental Neutron activation analysis,,,,,
ithaca,Restoring and attributing ancient texts using deep neural networks.,https://github.com/deepmind/ithaca,,,,,,,,,,,,,,deepmind,,,,,,Packages and libraries,Python,Literary analysis and epigraphy,Shape recognition,,,,,
archchron,For handling archaeological chronological data.,,,https://gitlab.com/oliver.nakoinz/archchron,,,,,,,,,,,,oliver.nakoinz,,,,,,Packages and libraries,R,Chronological modelling,,,,,,
tutorials,Tutorials on quantitative archaeology.,,,https://gitlab.com/oliver.nakoinz/tutorials,,,,,,,,,,,,oliver.nakoinz,,,,,,Guides,,Educational resources and practical guides,Statistical analysis,,,,,
c14-date-extractor,Script for extracting c14 dates from text.,https://github.com/alexbrandsen/c14-date-extractor,,,,,,,,,,,,,,alexbrandsen,,,,,,Scripts,,Bits and bobs,"Radiocarbon dating, calibration and sequencing",Writing,,,,
joint-disease-tool,"Interactively guides the user through a number of questions, ending in a specific pathology diagnosis.",https://github.com/alexbrandsen/joint-disease-tool,,,,,,,,,,,,,,alexbrandsen,,,,,,Packages and libraries,,Biological anthropology,,,,,,
pdf-to-nested-xml,"Script to convert a folder of Dutch archaeological reports (PDFs) to XML files nested by section, chapter, heading.",https://github.com/alexbrandsen/pdf-to-nested-xml,,,,,,,,,,,,,,alexbrandsen,,,,,,Scripts,Python,Bits and bobs,Writing,,,,,
archeo-bertje,A Dutch BERT model for the Archaeology domain.,https://github.com/alexbrandsen/archeo-bertje,,,,,,,,,,,,,,alexbrandsen,,,,,,"Specifications, protocols and schemas",,Machine learning,Schemas and ontologies,,,,,
archaeo-CRF,Conditional Random Fields model for NER in Dutch Archaeology.,https://github.com/alexbrandsen/archaeo-CRF,,,,,,,,,,,,,,alexbrandsen,,,,,,Packages and libraries,Python,Machine learning,Schemas and ontologies,,,,,
MapofComputationalArchaeology,Visualizes digital archaeology as a fantasy landscape.,https://github.com/sslarch/MapofComputationalArchaeology,,,,,,,,,,,,,,sslarch,,,,,,Products,,Diagrams and visualizations,,,,,,
chronup,Tools for chronological uncertainty propagation.,https://github.com/wccarleton/chronup,,,,,,,,,,,,,,wccarleton,,,,,,Packages and libraries,R,Chronological modelling,Statistical analysis,,,,,
recmod,Tools for estimating parameters for Radiocarbon-dated Event Count (REC) Models.,https://github.com/wccarleton/recmod,,,,,,,,,,,,,,wccarleton,,,,,,Packages and libraries,R,Chronological modelling,"Radiocarbon dating, calibration and sequencing",,,,,
timeperiod2daterange,Converts time period entities to standardised date ranges.,https://github.com/alexbrandsen/timeperiod2daterange,,,,,,,,,,,,,,alexbrandsen,,,,,,Scripts,Python,Chronological modelling,Bits and bobs,,,,,
rarcheo,Online textbook about how tackle a wide range of problems using R.,https://github.com/nfrerebeau/rarcheo,,,,,,,,,,,https://r-archeo.huma-num.fr/,,,nfrerebeau,,,,,,Guides,,Educational resources and practical guides,,,,,,
fellingDateR,Compute and combine felling date estimates for historical tree-ring series with (incomplete) sapwood.,https://github.com/hanecakr/fellingDateR,,,,,,,,,,,,,,hanecakr,,,,,,Packages and libraries,R,Chronological modelling,Dendrochronology,,,,,
rock-art-radnet,Rock art object detection model.,https://github.com/Swedish-Rock-Art-Research-Archives/rock-art-radnet,,,,,,,,,,,,,,Swedish-Rock-Art-Research-Archives,,,,,,Packages and libraries,Python,Shape recognition,Iconography,,,,,
rock-art-ratopoviz,Create visualizations from laserscans.,https://github.com/Swedish-Rock-Art-Research-Archives/rock-art-ratopoviz,,,,,,,,,,,,,,Swedish-Rock-Art-Research-Archives,,,,,,Packages and libraries,Python,Shape recognition,Iconography,,,,,
anthroFun,Functions to help with the preprocessing steps in anthropological research.,https://github.com/ElaineYChu/anthroFun,,,,,,,,,,,,,,ElaineYChu,,,,,,Scripts,R,Bits and bobs,,,,,,
arches-via-docker,Deployment of Arches via Docker for archaeology and related instruction.,https://github.com/opencontext/arches-via-docker,,,,,,,,,,,,,,opencontext,,,,,,Standalone software,,Drivers and IO,,,,,,
shootpoints-web-frontend,User interface to the ShootPoints Web total station surveying program.,https://github.com/Lugal-PCZ/shootpoints-web-frontend,,,,,,,,,,,,,,Lugal-PCZ,,,,,,Standalone software,,Site mapping,Data collection,,,,,
shootpoints-web-api,Back-end and middleware for the ShootPoints Web total station surveying program.,https://github.com/Lugal-PCZ/shootpoints-web-api,,,,,,,,,,,,,,Lugal-PCZ,,,,,,Standalone software,,Site mapping,API interfaces and web scrapers,,,,,
quantatools,Finding quantum in archaeological data using cosine quantogram and related statistical methods.,https://github.com/maciejkasinski/quantatools,,,,,,,,,,,,,10.5281/zenodo.2566606.svg,maciejkasinski,,,,,,Packages and libraries,R,Statistical analysis,,,,,,
BraDypUS,"Creating, impementing and publishing relational databases on the Web, especially for the archaeolgical domain.",https://github.com/lab-archeologia-digitale/BraDypUS,,,,,,,,,,,,,10.5281/zenodo.5577979.svg,lab-archeologia-digitale,,,,,,Standalone software,,Data management,,,,,,
Mastodon-Archaeology,Simple web app that helps to bulk follow archaeologists on the FOSS microblogging service Mastodon.,https://github.com/stark1tty/Mastodon-Archaeology,,,,,,,,,,,,,,stark1tty,,,,,,Lists and datasets,,Lists,Public archaeology,,,,,
ArchaeoAstroInsight,"QGIS Python script/plugin for computing azimuth, horizon altitude, and celestial declination of a specific bearing indicated by a line segment selected by a user.",https://github.com/marcfrincu/ArchaeoAstroInsight,,,,,,,,,,,,,,marcfrincu,,,,,,Packages and libraries,QGIS,Spatial analysis,Archaeoastronomy,,,,,
PleistoDist,Distance matrices between islands normalised over Pleistocene time.,https://github.com/g33k5p34k/PleistoDist,,,,,,,,,,,,,,g33k5p34k,,,,,,Packages and libraries,ArcGIS,Spatial analysis,,,,,,
PleistoDistR,Distance matrices between islands normalised over Pleistocene time. A complete ground-up rebuild of PleistoDist for use with R.,https://github.com/g33k5p34k/PleistoDistR,,,,,,,,,,,,,,g33k5p34k,,,,,,Packages and libraries,R,Spatial analysis,,,,,,
BioArch_R,Apps and functions for use in Bioarchaeology,https://github.com/AlisJay/BioArch_R,,,,,,,,,,,,,,AlisJay,,,,,,Packages and libraries,R,Biological anthropology,,,,,,
BioProfile,A shiny app which uses the results of standard osteological methods to create a basic biological profile,https://github.com/AlisJay/BioProfile,,,,,,,,,,,https://alisjay.shinyapps.io/BioProfile,,,AlisJay,,,,,,Packages and libraries,R,Biological anthropology,,,,,,
NASSA-modules,The modular library of the Network for Agent-based modelling of Socio-ecological systems in Archaeology,https://github.com/Archaeology-ABM/NASSA-modules,,,,,,,,,,,https://archaeology-abm.github.io/NASSA-modules,,,Archaeology-ABM,,,,,,Lists and datasets,,Simulation,Lists,,,,,
Material Sources for Early Islam and Late Antique Near East,A list of resources and materials for research on the history of Early Islam and the Late Antique Near East.,,,,,,,,,,,,https://materialsourcesforearlyislamandlateantiqueneareast.hcommons.org/,,,Hagit Nol,,,,,,Lists and datasets,,Lists,,,,,,
TPQ-Composer,Utility for graphically displaying a set of termini post quem induced from stratified archaeological artifacts.,https://github.com/Eythan31/TPQ-Composer,,,,,,,,,,,,,,Eythan31,,,,,,Packages and libraries,Python,Chronological modelling,,,,,,
Artifacts-Analyzer,Python script for analyzing data sets of archaeological artifacts containing only Boolean and categorical variables.,https://github.com/Eythan31/Artifacts-Analyzer,,,,,,,,,,,,,,Eythan31,,,,,,Packages and libraries,Python,Statistical analysis,,,,,,
PAThs Simple Vectorization Protocol,Protocol to vecotorize archaeological or architectonic legacy data.,,,,,,,,,,,,https://docs.paths-erc.eu/data/svp,,,PAThs,,,,,,Guides,,Site mapping,3D modelling,,,,,
ChronoLog,A tool for computer-assisted chronological research.,,,,,,,,,,,,https://chrono.ulb.be/,,10.1016/j.jas.2020.105225,Eythan Levy,Frédéric Pluquet,Gilles Geeraerts,,,,Standalone software,,Chronological modelling,,,,,,
IntChron,An indexing service for chronological information. Information can be viewed as webpages or downloaded as data files in different formats.,,,,,,,,,,,,https://intchron.org/,,10.1017/RDC.2019.21,Christopher Bronk Ramsey,,,,,,Lists and datasets,,Lists,,,,,,
DIGSS,"A simulation tool to estimate the rate of success that surveys possessing user-specific characteristics have in identifying archaeological sites (or any groups of clouds of objects), given specific parameters of survey area, survey methods, and site properties.",https://github.com/markhubbe/DIGSS,,,,,,,,https://cran.r-project.org/package=DIGSS,,,,,,markhubbe,,,,,,Packages and libraries,R,Simulation,Statistical analysis,,,,,
archaeosrp,Read PDFs with archaeological site report information and return the information in the forms as a dataframe.,https://github.com/seanbergin/archaeosrp,,,,,,,,,,,,,,seanbergin,,,,,,Packages and libraries,R,Writing,,,,,,
ancient-artifacts,Dynamic image analysis to identify ancient artifacts in soil samples.,https://github.com/vanderbilt-data-science/ancient-artifacts,,,,,,,,,,,,,,vanderbilt-data-science,,,,,,Packages and libraries,R,Shape recognition,Spatial analysis,,,,,
roev,Functions for analysing and visualizing rates of evolution.,https://github.com/benmarwick/roev,,,,,,,,,,,,,,benmarwick,,,,,,Packages and libraries,R,Statistical analysis,,,,,,
aoristic-analysis,Estimate probabilities of find numbers per period.,https://github.com/LimesLimits/aoristic-analysis,,,,,,,,,,,,,10.1016/j.jasrep.2016.10.006,LimesLimits,,,,,,Packages and libraries,Python,Statistical analysis,,,,,,
SEAHORS,R Shiny application that allows easy and quick exploration of the spatial distribution of archaeological objects.,https://github.com/AurelienRoyer/SEAHORS,,,,,,,,,,,,,,AurelienRoyer,,,,,,Packages and libraries,R,Spatial analysis,,,,,,
shoredate,Offers methods to shoreline date Stone Age sites located along the Norwegian Skagerrak coast based on their present-day elevation and the trajectory of past relative sea-level change.,https://github.com/isakro/shoredate,,,,,,,,https://cran.r-project.org/package=shoredate,,,,,,isakro,,,,,,Packages and libraries,R,Spatial analysis,Chronological modelling,,,,,
civ5-prehistoric,"Extends the game back millions years and multiple eras into the days when ""man"" first descended from the trees!",https://github.com/carlosfhernandez/civ5-prehistoric,,,,,,,,,,,https://github.com/carlosfhernandez/civ5-prehistoric/wiki/,,,carlosfhernandez,,,,,,Standalone software,,Games,,,,,,
archeoViz,"A packaged R 'Shiny' application for the visualisation, interactive exploration, and web communication of archaeological spatial data.",https://github.com/sebastien-plutniak/archeoviz,,,,,,,,https://cran.r-project.org/package=archeoViz,,,https://analytics.huma-num.fr/archeoviz/home/,,10.5281/zenodo.7460193,sebastien-plutniak,,,,,,Packages and libraries,R,Diagrams and visualizations,Spatial analysis,Site mapping,,,,
archeoViz Portal,An R Shiny application to gather and map datasets visualised using the archeoViz application,https://github.com/sebastien-plutniak/archeoviz-portal,,,,,,,,,,,https://analytics.huma-num.fr/archeoviz/home/,,,sebastien-plutniak,,,,,,Lists and datasets,R,Platforms and publications,Data collection,Datasets,,,,
Excavation_data_viewer,R Shiny app for viewing archaeological excavation data in 3D.,https://github.com/samclin/Excavation_data_viewer,,,,,,,,,,,,,,samclin,,,,,,Packages and libraries,R,Data management,3D modelling,,,,,
ARchaeology,View the AR models on your phone.,https://github.com/lili0824/ARchaeology,,,,,,,,,,,,,,lili0824,,,,,,Standalone software,,3D modelling,Augmented reality,Site mapping,,,,
StoneAdvisor,Explore and share your favourite archaeological sites and itineraries.,https://github.com/rbbristow/StoneAdvisor,,,,,,,,,,,,,,rbbristow,,,,,,Standalone software,Python,Public archaeology,Museums,,,,,
3D_EdgeAngle,Semi-automated 3D digital method to systematically quantify stone tool edge angle and design.,https://github.com/lschunk/3D_EdgeAngle,,,,,,,,,,,,,10.5281/zenodo.7956767,lschunk,Ivan Calandra,Konstantin Bob,,,,Packages and libraries,Python,Artefact morphology,3D modelling,,,,,
isopleuros,Ternary plots made simple.,https://github.com/tesselle/isopleuros,,,,,,,,https://cran.r-project.org/package=isopleuros,,,https://packages.tesselle.org/isopleuros/,,10.5281/zenodo.7940389,tesselle,,,,,,Packages and libraries,R,Diagrams and visualizations,,,,,,
ZooarchMixMod,"Produce mixture models of zooarchaeological measurement data to estimate the proportion of immature, adult-sized female, and adult-sized male specimens in an assemblage.",https://github.com/wolfhagenj/ZooarchMixMod,,,,,,,,,,,,,10.1007/s10816-023-09611-y,wolfhagenj,,,,,,Packages and libraries,R,Zooarchaeology,,,,,,
ArchaeoCal,An R Interface to OxCal.,https://github.com/ArchaeoStat/ArchaeoCal,,,,,,,,,,,https://archaeostat.github.io/ArchaeoCal/,,,nfrerebeau,,,,,,Packages and libraries,R,"Radiocarbon dating, calibration and sequencing",,,,,,
ArchaeoData,Models and data to reproduce results from ArchaeoPhases examples and vignettes.,https://github.com/ArchaeoStat/ArchaeoData,,,,,,,,,,,https://archaeostat.github.io/ArchaeoData/,,,nfrerebeau,,,,,,Packages and libraries,R,"Radiocarbon dating, calibration and sequencing",Datasets,,,,,
aion,Provides a system of classes and methods to represent and work with archaeological time-series.,https://github.com/tesselle/aion,,,,,,,,https://cran.r-project.org/package=aion,,,https://packages.tesselle.org/aion/,https://doi.org/10.21105/joss.06210,10.5281/zenodo.8032278,tesselle,,,,,,Packages and libraries,R,Chronological modelling,,,,,,
alkahest,Pre-Processing XY Data from Experimental Methods.,https://github.com/tesselle/alkahest,,,,,,,,https://cran.r-project.org/package=alkahest,,,https://packages.tesselle.org/alkahest/,,10.5281/zenodo.7081524,tesselle,,,,,,Packages and libraries,R,Statistical analysis,,,,,,
Akkademia,"Translating Akkadian signs to transcriptions using NLP techniques such as HMM, MEMM and BiLSTM neural networks.",https://github.com/gaigutherz/Akkademia,,,,,,,,,,,,,,gaigutherz,arielazary,ARomach,ireman,,,Packages and libraries,Python,Machine learning,Literary analysis and epigraphy,,,,,
teethr,Calculate dental indices and lesion ratios.,https://github.com/bbartholdy/teethr,,,,,,,,,,,,,,bbartholdy,,,,,,Packages and libraries,R,Zooarchaeology,,,,,,
morphotype,Provide a pipeline from shape data extraction to typological arrangement of pottery profiles.,https://github.com/kafetzakid/morphotype,,,,,,,,,,,,,10.5281/zenodo.8224882,kafetzakid,,,,,,Packages and libraries,R,Artefact morphology,Shape recognition,Ceramic analysis,,,,
morphotypeShiny,Shiny implementation of morphotype.,https://github.com/kafetzakid/morphotypeShiny,,,,,,,,,,,,,10.5281/zenodo.6760607,kafetzakid,,,,,,Packages and libraries,R,Artefact morphology,Shape recognition,,,,,
pleiades.datasets,Platform-independent versions of Pleiades gazetteer data.,https://github.com/isawnyu/pleiades.datasets,,,,,,,,,,,https://pleiades.stoa.org/,,10.5281/zenodo.8206033,isawnyu,,,,,,Lists and datasets,,Datasets,,,,,,
ArcheOS,Linux distribution with specialist software for archaeological purposes.,https://github.com/archeos/ArcheOS,,,,,,,,,,,https://distrowatch.com/table.php?distribution=archeos,,,archeos,,,,,,Standalone software,,Drivers and IO,Bits and bobs,,,,,
ArcheoShape,Analysis tools for geometric models of archaeological pieces.,https://github.com/omendoza83/ArcheoShape,,,,,,,,,,,,,,omendoza83,,,,,,Standalone software,,Artefact morphology,,,,,,
ArchaeolPhytoliths,Automated detection and classification of multi-cell phytoliths at genera and species-level using Deep Learning algorithm.,https://github.com/iberganzo/ArchaeolPhytoliths,,,,,,,,,,,,,,iberganzo,,,,,,Packages and libraries,Python,Palaeobotany,Machine learning,Shape recognition,,,,
14C-power-sensitivity,How wrong is wrong and how good can it get? 14C chronological model power and sensitivity analyses with OxCal and R.,https://github.com/pete-jacobsson/14C-power-sensitivity,,,,,,,,,,,,,,pete-jacobsson,,,,,,Packages and libraries,R,"Radiocarbon dating, calibration and sequencing",,,,,,
EDM,Configurable data collection program for archaeological survey and excavation.,https://github.com/surf3s/EDM,,,,,,,,,,,,,,surf3s,,,,,,Packages and libraries,Python,Data collection,Data management,,,,,
EDMWIN,Configurable data collection program for archaeological survey and excavation.,https://github.com/surf3s/EDMWIN,,,,,,,,,,,,,,surf3s,,,,,,Packages and libraries,Python,Data collection,Data management,,,,,
fabryka,Shiny app fabric analysis.,https://github.com/marchaeologist/fabryka,,,,,,,,,,,,,,marchaeologist,,,,,,Scripts,R,Site mapping,Spatial analysis,,,,,
3d_spatial_ripley_analyses,Test spatial associations of objects in three dimensions by using the Ripley's K function.,https://github.com/marchaeologist/3d_spatial_ripley_analyses,,,,,,,,,,,,,,marchaeologist,,,,,,Scripts,R,Site mapping,Spatial analysis,,,,,
R for data analysis and visualization of Archaological Data,"Data Analysis and Visualization in R for Archaologists, modified from the Data Carpentry R Workshop for Ecologists.",https://github.com/carpentries-incubator/R-archaeology-lesson,,,,,,,,,,,https://carpentries-incubator.github.io/R-archaeology-lesson/,,,carpentries-incubator,Alison Clarke,François Michonneau,Auriel Fournier,,,Guides,R,Educational resources and practical guides,,,,,,
Scroll Viewer,Viewer for the Herculaneum Papyri segments.,https://github.com/atiro/scroll-viewer,,,,,,,,,,,,,,atiro,,,,,,Standalone software,,Literary analysis and epigraphy,3D modelling,,,,,
mobest,"An R package that provides types and functions for spatiotemporal interpolation of human genetic ancestry components, probabilistic similarity search and the calculation of a derived measure for mobility estimation.",https://github.com/nevrome/mobest,,,,,,,,,,,https://nevrome.de/mobest/html/master/,https://doi.org/10.1073/pnas.2218375120,,nevrome,,,,,,Packages and libraries,R,Archaeogenetics,Simulation,,,,,
vici.org,"A community driven archaeological map of classical antiquity, inspired by and modelled after Wikipedia.",https://github.com/renevoorburg/vici.org,,,,,,,,,,,https://vici.org,,,renevoorburg,,,,,,Standalone software,,Public archaeology,Spatial analysis,Datasets,,,,
pastclim,Methods to easily extract and manipulate palaeoclimate reconstructions for ecological and anthropological analyses.,https://github.com/EvolEcolGroup/pastclim/,,,,,,,,https://cran.r-project.org/package=pastclim,,,https://evolecolgroup.github.io/pastclim/,,,EvolEcolGroup,Michela Leonardi,Emily Y. Hallet,Robert Beyer,Mario Krapp,Andrea Manica,Packages and libraries,R,Simulation,Palaeoclimate modelling,,,,,
currycarbon,App to run C14 calibration on the command line. Includes and is based on a calibration module written in and for Haskell.,https://github.com/nevrome/currycarbon,,,,,,,,,,,,,,nevrome,,,,,,Standalone software,,"Radiocarbon dating, calibration and sequencing",Chronological modelling,,,,,
morphalr,Morphological analysis for archaeology.,https://github.com/JGravier/morphalr,,,,,,,,,,,https://jgravier.github.io/morphalr/,,,JGravier,,,,,,Packages and libraries,R,Spatial analysis,,,,,,
ExtendedMatrix,A scientific method and formal language for the Cultural Heritage domain that formalises complex interpretative philological phenomena such as virtual reconstructive hypotheses in a transparent and robust manner.,https://github.com/zalmoxes-laran/ExtendedMatrix,,,,,,,,,,,https://www.extendedmatrix.org/home,https://doi.org/10.3390/heritage6020069,,zalmoxes-laran,Bruno Fanini,Enzo Cocca,,,,Standalone software,,Schemas and ontologies,,,,,,
3D-survey-collection,Blender addon that simplifies the tasks involved in the management and optimization of the archaeological and architectonic 3D record.,https://github.com/zalmoxes-laran/3D-survey-collection,,,,,,,,,,,,,,zalmoxes-laran,,,,,,Packages and libraries,Blender,3D modelling,,,,,,
EM-blender-tools,Addon that brings the formal language Extended Matrix within the Blender 3D open-source software.,https://github.com/zalmoxes-laran/EM-blender-tools,,,,,,,,,,,,,,zalmoxes-laran,,,,,,Packages and libraries,Blender,3D modelling,,,,,,
digging.digital.data,Various legacy archaeology datasets for use as practical pedagogical case studies.,https://github.com/chrinne/digging.digital.data,,,,,,,,,,,,,,chrinne,,,,,,Lists and datasets,,Educational resources and practical guides,Datasets,,,,,
